<?xml version="1.0" encoding="UTF-8"?>
<ikasleak xmlns:xsi="http://www.w3.org/2001/XMLSchema-instance"
    xsi:noNamespaceSchemaLocation="ikasleak3.xsd">
    <ikaslea>
        <nan>11111111</nan>
        <izena>Iraide Etxeberria</izena>
        <helbidea>
            <kalea>Kale nagusia</kalea>
            <zbk>5</zbk>
            <herria>Bilbao</herria>
            <probintzia>Bizkaia</probintzia>
        </helbidea>
        <telefonoa>944000000</telefonoa>
    </ikaslea>
    <ikaslea>
        <nan>22222222</nan>
        <izena>Joseba Mikel Zarraga</izena>
        <helbidea>
            <kalea>Gorbeia</kalea>
            <zbk>75</zbk>
            <herria>Artea</herria>
            <probintzia>Bizkaia</probintzia>
        </helbidea>
        <telefonoa>944999999</telefonoa>
        <telefonoa>564654243</telefonoa>
        <eposta>joseba@gmail.com</eposta>
    </ikaslea>
</ikasleak>